{
  "benchmark_id": "bench_det_vs_hnet_001",
  "benchmark_family": "chunking",
  "corpus_manifest_ref": "examples/synthetic-tenant/phase-4/benchmark-corpus-manifest.v1.example.json",
  "systems": [
    {"system_id": "deterministic_v1", "kind": "canonical_chunker", "version": "1.0.0"},
    {"system_id": "hnet_overlay_v1", "kind": "chunk_overlay", "version": "0.3.2"}
  ],
  "metrics": [
    {"name": "retrieval_hit_rate_at_5", "direction": "higher_is_better"},
    {"name": "provenance_retention_rate", "direction": "higher_is_better"},
    {"name": "rerun_stability", "direction": "higher_is_better"},
    {"name": "mean_chunk_count", "direction": "lower_is_better"}
  ],
  "results": [
    {
      "system_id": "deterministic_v1",
      "metric_values": {
        "retrieval_hit_rate_at_5": 0.72,
        "provenance_retention_rate": 1.0,
        "rerun_stability": 1.0,
        "mean_chunk_count": 14.0
      },
      "notes": "Baseline deterministic chunker"
    },
    {
      "system_id": "hnet_overlay_v1",
      "metric_values": {
        "retrieval_hit_rate_at_5": 0.81,
        "provenance_retention_rate": 1.0,
        "rerun_stability": 0.96,
        "mean_chunk_count": 10.0
      },
      "notes": "Adaptive overlay improved retrieval with small stability penalty"
    }
  ]
}
